{
  "type": "object",
  "properties": {
    "schema_version": {
      "type": "integer",
      "const": 1
    },
    "kind": {
      "type": "string",
      "const": "schooltool.assessment"
    },
    "exercise_id": {
      "type": "string",
      "minLength": 1
    },
    "exercise": {
      "type": "object",
      "properties": {
        "title": {
          "type": "string",
          "minLength": 1
        },
        "subject": {
          "type": "string",
          "minLength": 1
        },
        "group": {
          "type": "string",
          "minLength": 1
        },
        "date": {
          "type": "string",
          "minLength": 1
        },
        "checkpoint": {
          "type": "string",
          "minLength": 1
        }
      },
      "required": [
        "title",
        "subject",
        "group",
        "date",
        "checkpoint"
      ],
      "additionalProperties": false
    },
    "maximum_minor": {
      "type": "integer",
      "minimum": 1,
      "maximum": 9007199254740991
    },
    "rubric": {
      "type": "array",
      "items": {
        "$ref": "#/$defs/rubric"
      },
      "minItems": 1
    },
    "records": {
      "type": "array",
      "items": {
        "$ref": "#/$defs/record"
      },
      "minItems": 1,
      "maxItems": 99
    },
    "overview_pdf": {
      "$ref": "#/$defs/pdf"
    },
    "package_checksum": {
      "type": "string",
      "pattern": "^[0-9a-f]{64}$"
    },
    "submission_check": {
      "$ref": "#/$defs/submission_check"
    },
    "teacher_absence_decision": {
      "$ref": "#/$defs/teacher_absence_decision"
    }
  },
  "required": [
    "schema_version",
    "kind",
    "exercise_id",
    "exercise",
    "maximum_minor",
    "rubric",
    "records",
    "overview_pdf",
    "package_checksum"
  ],
  "additionalProperties": false,
  "$schema": "https://json-schema.org/draft/2020-12/schema",
  "title": "Schooltool assessment v1",
  "$defs": {
    "teacher_absence_decision": {
      "type": "object",
      "properties": {
        "schema_version": {"type": "integer", "const": 1},
        "kind": {"type": "string", "const": "schooltool.teacher-absence-decision"},
        "exercise_id": {"type": "string", "minLength": 1},
        "participant_ids": {"type": "array", "items": {"type": "string", "minLength": 1}, "minItems": 1},
        "deadline_at": {"type": "string"},
        "decided_at": {"type": "string"},
        "deadline_evidence_sha256": {"type": "string", "pattern": "^[0-9a-f]{64}$"},
        "instruction": {"type": "string", "minLength": 1},
        "reason": {"type": "string", "const": "Innerhalb der Frist nicht abgegeben"},
        "search_state": {"type": "string", "const": "incomplete"},
        "decision_checksum": {"type": "string", "pattern": "^[0-9a-f]{64}$"}
      },
      "required": ["schema_version", "kind", "exercise_id", "participant_ids", "deadline_at", "decided_at", "deadline_evidence_sha256", "instruction", "reason", "search_state", "decision_checksum"],
      "additionalProperties": false
    },
    "identity": {
      "type": "object",
      "properties": {
        "first_name": {
          "type": "string",
          "minLength": 1
        },
        "last_name": {
          "type": "string",
          "minLength": 1
        },
        "class_name": {
          "type": "string",
          "minLength": 1
        },
        "group_name": {
          "type": "string",
          "minLength": 1
        },
        "schooltool_person_id": {
          "type": [
            "string",
            "null"
          ],
          "minLength": 1
        }
      },
      "required": [
        "first_name",
        "last_name",
        "class_name",
        "group_name",
        "schooltool_person_id"
      ],
      "additionalProperties": false
    },
    "rubric": {
      "type": "object",
      "properties": {
        "criterion": {
          "type": "string",
          "minLength": 1
        },
        "maximum_minor": {
          "type": "integer",
          "minimum": 1,
          "maximum": 9007199254740991
        }
      },
      "required": [
        "criterion",
        "maximum_minor"
      ],
      "additionalProperties": false
    },
    "criterion": {
      "type": "object",
      "properties": {
        "criterion": {
          "type": "string",
          "minLength": 1
        },
        "maximum_minor": {
          "type": "integer",
          "minimum": 1,
          "maximum": 9007199254740991
        },
        "earned_minor": {
          "type": [
            "integer",
            "null"
          ],
          "minimum": 0,
          "maximum": 9007199254740991
        },
        "checkability": {
          "type": "string",
          "enum": [
            "checkable",
            "uncheckable",
            "unresolved"
          ]
        },
        "reason": {
          "type": "string",
          "minLength": 1
        }
      },
      "required": [
        "criterion",
        "maximum_minor",
        "earned_minor",
        "checkability",
        "reason"
      ],
      "additionalProperties": false
    },
    "adjustment": {
      "type": "object",
      "properties": {
        "label": {
          "type": "string",
          "minLength": 1
        },
        "amount_minor": {
          "type": "integer",
          "minimum": -9007199254740991,
          "maximum": 9007199254740991
        },
        "reason": {
          "type": "string",
          "minLength": 1
        }
      },
      "required": [
        "label",
        "amount_minor",
        "reason"
      ],
      "additionalProperties": false
    },
    "record": {
      "type": "object",
      "properties": {
        "participant_id": {
          "type": "string",
          "minLength": 1
        },
        "identity": {
          "$ref": "#/$defs/identity"
        },
        "submission_state": {
          "type": "string",
          "enum": [
            "received",
            "unresolved",
            "not_received"
          ]
        },
        "submission_note": {
          "type": "string",
          "minLength": 1
        },
        "evaluation_state": {
          "type": "string",
          "enum": [
            "complete",
            "open",
            "partial"
          ]
        },
        "evaluation_note": {
          "type": "string",
          "minLength": 1
        },
        "total_minor": {
          "type": [
            "integer",
            "null"
          ],
          "minimum": 0,
          "maximum": 9007199254740991
        },
        "criteria": {
          "type": "array",
          "items": {
            "$ref": "#/$defs/criterion"
          },
          "minItems": 1
        },
        "adjustments": {
          "type": "array",
          "items": {
            "$ref": "#/$defs/adjustment"
          }
        },
        "comment": {
          "type": "string",
          "minLength": 1
        },
        "source_fingerprint": {
          "type": "string",
          "pattern": "^[0-9a-f]{64}$"
        },
        "pdf": {
          "$ref": "#/$defs/pdf"
        },
        "record_checksum": {
          "type": "string",
          "pattern": "^[0-9a-f]{64}$"
        },
        "email_collected_at": {
          "type": [
            "string",
            "null"
          ],
          "pattern": "^\\d{4}-\\d{2}-\\d{2}T\\d{2}:\\d{2}:\\d{2}(?:\\.\\d{1,6})?Z$"
        },
        "evaluation_completed_at": {
          "type": [
            "string",
            "null"
          ],
          "pattern": "^\\d{4}-\\d{2}-\\d{2}T\\d{2}:\\d{2}:\\d{2}(?:\\.\\d{1,6})?Z$"
        }
      },
      "required": [
        "participant_id",
        "identity",
        "submission_state",
        "submission_note",
        "evaluation_state",
        "evaluation_note",
        "total_minor",
        "criteria",
        "adjustments",
        "comment",
        "source_fingerprint",
        "pdf",
        "record_checksum"
      ],
      "additionalProperties": false
    },
    "pdf": {
      "type": [
        "object",
        "null"
      ],
      "properties": {
        "filename": {
          "type": "string",
          "pattern": "^[^<>:\"/\\\\|?*]+\\.pdf$"
        },
        "sha256": {
          "type": "string",
          "pattern": "^[0-9a-f]{64}$"
        }
      },
      "required": [
        "filename",
        "sha256"
      ],
      "additionalProperties": false
    },
    "submission_check": {
      "type": "object",
      "properties": {
        "schema_version": {
          "type": "integer",
          "const": 1
        },
        "kind": {
          "type": "string",
          "const": "schooltool.submission-check"
        },
        "exercise_id": {
          "type": "string",
          "minLength": 1
        },
        "timezone": {
          "type": "string",
          "const": "Europe/Vienna"
        },
        "deadline_at": {
          "type": "string",
          "pattern": "^\\d{4}-\\d{2}-\\d{2}T\\d{2}:\\d{2}:\\d{2}(?:\\.\\d{1,6})?Z$"
        },
        "checked_at": {
          "type": "string",
          "pattern": "^\\d{4}-\\d{2}-\\d{2}T\\d{2}:\\d{2}:\\d{2}(?:\\.\\d{1,6})?Z$"
        },
        "roster_fingerprint": {
          "type": "string",
          "pattern": "^[0-9a-f]{64}$"
        },
        "roster_evidence_sha256": {
          "type": "array",
          "items": {
            "type": "string",
            "pattern": "^[0-9a-f]{64}$"
          },
          "minItems": 1
        },
        "deadline_evidence_sha256": {
          "type": "array",
          "items": {
            "type": "string",
            "pattern": "^[0-9a-f]{64}$"
          },
          "minItems": 1
        },
        "participants": {
          "type": "array",
          "items": {
            "type": "object",
            "properties": {
              "participant_id": {
                "type": "string",
                "minLength": 1
              },
              "dispatched_at": {
                "type": "string",
                "pattern": "^\\d{4}-\\d{2}-\\d{2}T\\d{2}:\\d{2}:\\d{2}(?:\\.\\d{1,6})?Z$"
              },
              "email_result": {
                "type": "string",
                "enum": [
                  "received",
                  "not_found",
                  "unresolved"
                ]
              },
              "other_result": {
                "type": "string",
                "enum": [
                  "received",
                  "not_received",
                  "unresolved"
                ]
              },
              "evidence_sha256": {
                "type": "array",
                "items": {
                  "type": "string",
                  "pattern": "^[0-9a-f]{64}$"
                },
                "minItems": 1
              },
              "gaps": {
                "type": "array",
                "items": {
                  "type": "string",
                  "minLength": 1
                },
                "minItems": 0
              }
            },
            "required": [
              "participant_id",
              "dispatched_at",
              "email_result",
              "other_result",
              "evidence_sha256",
              "gaps"
            ],
            "additionalProperties": false
          },
          "minItems": 1
        },
        "coverage": {
          "type": "array",
          "items": {
            "type": "object",
            "properties": {
              "mailbox": {
                "type": "string",
                "enum": [
                  "guenther.kron@cdgym.at",
                  "guenther.kron@bildung.gv.at"
                ]
              },
              "scope": {
                "type": "string",
                "enum": [
                  "local_cache",
                  "server_all_folders",
                  "unavailable"
                ]
              },
              "verified": {
                "type": "boolean"
              },
              "start_at": {
                "type": "string",
                "pattern": "^\\d{4}-\\d{2}-\\d{2}T\\d{2}:\\d{2}:\\d{2}(?:\\.\\d{1,6})?Z$"
              },
              "end_at": {
                "type": "string",
                "pattern": "^\\d{4}-\\d{2}-\\d{2}T\\d{2}:\\d{2}:\\d{2}(?:\\.\\d{1,6})?Z$"
              },
              "evidence_sha256": {
                "type": "array",
                "items": {
                  "type": "string",
                  "pattern": "^[0-9a-f]{64}$"
                },
                "minItems": 0
              },
              "gaps": {
                "type": "array",
                "items": {
                  "type": "string",
                  "minLength": 1
                },
                "minItems": 0
              }
            },
            "required": [
              "mailbox",
              "scope",
              "verified",
              "start_at",
              "end_at",
              "evidence_sha256",
              "gaps"
            ],
            "additionalProperties": false
          },
          "minItems": 0
        },
        "unresolved_candidates": {
          "type": "array",
          "items": {
            "type": "object",
            "properties": {
              "candidate_fingerprint": {
                "type": "string",
                "pattern": "^[0-9a-f]{64}$"
              },
              "evidence_sha256": {
                "type": "array",
                "items": {
                  "type": "string",
                  "pattern": "^[0-9a-f]{64}$"
                },
                "minItems": 1
              }
            },
            "required": [
              "candidate_fingerprint",
              "evidence_sha256"
            ],
            "additionalProperties": false
          },
          "minItems": 0
        },
        "gaps": {
          "type": "array",
          "items": {
            "type": "string",
            "minLength": 1
          },
          "minItems": 0
        },
        "state": {
          "type": "string",
          "enum": [
            "open",
            "complete"
          ]
        },
        "completed_at": {
          "type": [
            "string",
            "null"
          ],
          "pattern": "^\\d{4}-\\d{2}-\\d{2}T\\d{2}:\\d{2}:\\d{2}(?:\\.\\d{1,6})?Z$"
        },
        "check_checksum": {
          "type": "string",
          "pattern": "^[0-9a-f]{64}$"
        }
      },
      "required": [
        "schema_version",
        "kind",
        "exercise_id",
        "timezone",
        "deadline_at",
        "checked_at",
        "roster_fingerprint",
        "roster_evidence_sha256",
        "deadline_evidence_sha256",
        "participants",
        "coverage",
        "unresolved_candidates",
        "gaps",
        "state",
        "completed_at",
        "check_checksum"
      ],
      "additionalProperties": false
    }
  }
}
